{
  "id": "urn:ngsi-ld:Itinerary:eixample-round-monday-am",
  "type": "Itinerary",
  "dateCreated": "2026-01-20T10:00:00Z",
  "dateModified": "2026-09-25T06:15:00Z",
  "source": "https://example.org/waste-management/itineraries/eixample-round-monday-am",
  "dataProvider": "AjuntamentDeBarcelona",
  "location": {
    "type": "LineString",
    "coordinates": [
      [2.1263, 41.3453],
      [2.1420, 41.3620],
      [2.1589, 41.3879],
      [2.1610, 41.3950]
    ]
  },
  "consistsOf": [
    "urn:ngsi-ld:RoadSegment:seg-001",
    "urn:ngsi-ld:RoadSegment:seg-002"
  ],
  "averageSpeedLimit": 30,
  "length": 12.5
}
